{"change_digest":"sha256:d1bb3828fe0bd93a81727f379ddc713b77475db8032b71f8b962fcfcd1610677","check_id":"supplied-epoch-binder-check","disposition":"ALLOW","hb_epoch":"469411750","head_sha":"764070689f0dd793c987d27d7cbf3252f37a6b47","schema":"stegverse.sv_check_receipt.v1","verifier_ref":"SV-LLM/.github:sandbox/s1_sv_check_receipts.py#sha256:738d1c346c4b434629c5ee1fa74438f42ad9d5339b272971a1e025c0835bc260"}
