{"change_digest":"sha256:332e03ae6fff6a8acfbec7494004a117ec91acc15937b700755fd6cb0e81fcb2","check_id":"schema-validate","disposition":"FAIL_CLOSED","failed_predicate":"EVERY_COMMAND_PATH_IS_PRESENT_AT_THE_EXACT_HEAD","failure_code":"CHECK_COMMAND_ABSENT_AT_HEAD","hb_epoch":"469411750","head_sha":"e29493afce3ee7b50c663a0fd5499a489ecc644b","next_attempt":"re-mint at a head that carries the command paths","owning_existing_goal":"StegVerse-org/.github#163 / SV-CHANGE-REQUIRED-CHECKS-001 (NWI-S1, #162)","required_evidence_or_repair":"the head carrying data/sv-work-items/required-checks.json, resident-runtime/admission_learning.py, resident-runtime/schema_subset.py, resident-runtime/sv_migration.py, resident-runtime/sv_work_items.py, schemas/sv-change.v1.schema.json, schemas/sv-issue.v1.schema.json, scripts/build_sv_native_fixtures.py (command_paths of schema-validate)","retry_entrypoint":"sandbox/s1_sv_check_receipts.py mint --input <input.json> --checkout <head checkout> --dependency labs-row=<StegVerse-Labs/.github checkout> --out-dir <dir>","schema":"stegverse.sv_check_receipt.v1","verifier_ref":"SV-LLM/.github:sandbox/s1_sv_check_receipts.py#sha256:5d1d6479d9556bb90d9871b44530777023595a249c6beee3e8a0fbef27a63fce"}
