{"change_digest":"sha256:209aa43f982373d356513270c086615569788e7d3ab8e9d3b2cf254055fe26f5","check_id":"unit-tests","disposition":"ALLOW","hb_epoch":"4000","head_sha":"f4080202d8fc3057516978f143cd23732681a9e0","schema":"stegverse.sv_check_receipt.v1","verifier_ref":"SV-LLM/.github:sandbox/s1_sv_check_receipts.py#sha256:2308d9b28cd8577a4c8ad37192d4a1b9d0c01b02e91b70a62507a58a5bcf3b14"}
