{"change_digest":"sha256:e44de675c0e3b6375eff9198cab9f1d7b133a73565f2d56955723ba9826edce2","check_id":"supplied-epoch-binder-check","disposition":"ALLOW","hb_epoch":"469411750","head_sha":"7898cedba1400c8545cebcb463fd26deb25f7d5a","schema":"stegverse.sv_check_receipt.v1","verifier_ref":"SV-LLM/.github:sandbox/s1_sv_check_receipts.py#sha256:9bc988fcbcae1ec4d3c582cd159b8475370673edddcd739727e2aefef412a478"}
