{"change_digest":"sha256:d1bb3828fe0bd93a81727f379ddc713b77475db8032b71f8b962fcfcd1610677","check_id":"workflow-surface-registered","disposition":"FAIL_CLOSED","failed_predicate":"THE_COMMAND_GIVES_THE_ROWS_EXPECTED_RESULT","failure_code":"REQUIRED_CHECK_FAILED_AT_HEAD","hb_epoch":"469411750","head_sha":"764070689f0dd793c987d27d7cbf3252f37a6b47","next_attempt":"repair at a new head and re-mint","owning_existing_goal":"StegVerse-org/.github#163 / SV-CHANGE-REQUIRED-CHECKS-001 (NWI-S1, #162)","required_evidence_or_repair":"repair workflow-surface-registered at a new head (see the bundle's checks entry)","retry_entrypoint":"sandbox/s1_sv_check_receipts.py mint --input <input.json> --checkout <head checkout> --dependency labs-row=<StegVerse-Labs/.github checkout> --out-dir <dir>","schema":"stegverse.sv_check_receipt.v1","verifier_ref":"SV-LLM/.github:sandbox/s1_sv_check_receipts.py#sha256:738d1c346c4b434629c5ee1fa74438f42ad9d5339b272971a1e025c0835bc260"}
