{"change_digest":"sha256:a3d014df9266ab01ec9e21d069f366bc5e39d13b0279d64c48b07ac65eb35842","check_id":"unit-tests","disposition":"ALLOW","hb_epoch":"469411750","head_sha":"7898cedba1400c8545cebcb463fd26deb25f7d5a","schema":"stegverse.sv_check_receipt.v1","verifier_ref":"SV-LLM/.github#46:sha256:e91be0adefa69b29c98afeb55c37377833d5c0a601d0f6af06a7e9cd483443cc"}
