{"change_digest":"sha256:dd6acf613fd9001dd369cb3ef9428a9f216edec28cb05af0de9305c366281be0","check_id":"workflow-surface-registered","disposition":"FAIL_CLOSED","failed_predicate":"THE_DECLARED_HEAD_IS_PRESENT_IN_THE_CHECKOUT","failure_code":"HEAD_NOT_MATERIALIZED","hb_epoch":"4000","head_sha":"dd8bfd027ca11f8c2c48d505d901d153cb0c8601","next_attempt":"re-run once the checkout holds the head","owning_existing_goal":"StegVerse-org/.github#163 / SV-CHANGE-REQUIRED-CHECKS-001 (NWI-S1, #162)","required_evidence_or_repair":"--checkout holding commit dd8bfd027ca11f8c2c48d505d901d153cb0c8601 (the verifier never fetches)","retry_entrypoint":"sandbox/s1_sv_check_receipts.py mint --input <input.json> --checkout <head checkout> --dependency labs-row=<StegVerse-Labs/.github checkout> --out-dir <dir>","schema":"stegverse.sv_check_receipt.v1","verifier_ref":"SV-LLM/.github:sandbox/s1_sv_check_receipts.py#sha256:6713e105690af6476bc90f77553de50a06df8e1fa9f6f94374d55e12eeaf3087"}
