{"change_digest":"sha256:25f010cde2dd33fdd00361ba84202978a3a2a6302a613cd780235c6914d6e44c","check_id":"supplied-epoch-binder-check","disposition":"ALLOW","hb_epoch":"469411750","head_sha":"7d940851034697c019684ec073ea676f27d7ac37","schema":"stegverse.sv_check_receipt.v1","verifier_ref":"SV-LLM/.github:sandbox/s1_sv_check_receipts.py#sha256:069fd1bd6b72126a330cd7a2f4dc833cc865f0e53e622ae660bb7ccc526b2d75"}
