{"change_digest":"sha256:4c217bcf70d2761371703408ea2be8861b9d31e716dfa266f15f4068dcc1c912","check_id":"supplied-epoch-binder-check","disposition":"FAIL_CLOSED","failed_predicate":"CHECK_HAS_OFFLINE_COMMAND","failure_code":"CHECK_COMMAND_UNDECLARED","hb_epoch":"4000","head_sha":"f82c0324aa4b6ac74adc44a3541ac98b33826447","next_attempt":"after such a command exists in this repo and is declared in this row; until then every ledger_writer change fails closed on this check","owning_existing_goal":"StegVerse-org/.github#163","required_evidence_or_repair":"an offline command in StegVerse-Labs/.github that performs the supplied-epoch binder check (the StegVerse-org/.github#189 189-binder-check rows), declared here with offline_command, expected and command_paths; nothing in this repo performs it at d2ba0957","retry_entrypoint":"data/sv-work-items/required-checks.json#checks.supplied-epoch-binder-check (resident-runtime/sv_work_items.py::check_command)","schema":"stegverse.sv_check_receipt.v1","verifier_ref":"SV-LLM/.github:sandbox/s1_sv_check_receipts.py#sha256:2308d9b28cd8577a4c8ad37192d4a1b9d0c01b02e91b70a62507a58a5bcf3b14"}
