{"change_digest":"sha256:1d56ab089e25853ae232658014c7c8e6602cbb68822c962b0ab0339a7fcac3c0","check_id":"schema-validate","disposition":"FAIL_CLOSED","failed_predicate":"EVERY_COMMAND_PATH_IS_PRESENT_AT_THE_EXACT_HEAD","failure_code":"CHECK_COMMAND_ABSENT_AT_HEAD","hb_epoch":"469411750","head_sha":"978b8880d238dc3e3a8b690c0675d8bb0e9d6985","next_attempt":"re-evaluate at a commit that carries them","owning_existing_goal":"StegVerse-org/.github#163 / NWI-S0 exit_gate_check (NWI-S1, #162)","required_evidence_or_repair":"the evaluated commit carrying data/sv-work-items/required-checks.json, resident-runtime/admission_learning.py, resident-runtime/schema_subset.py, resident-runtime/sv_migration.py, resident-runtime/sv_work_items.py, schemas/sv-change.v1.schema.json, schemas/sv-issue.v1.schema.json, scripts/build_sv_native_fixtures.py","retry_entrypoint":"sandbox/s1_nwi_s0_exit_gate.py evaluate --input <stage-evaluation input> --checkout <repository clone> --p1 <StegVerse-Labs/.github clone> --out-dir <dir>","schema":"stegverse.sv_check_receipt.v1","verifier_ref":"SV-LLM/.github#46:sha256:e91be0adefa69b29c98afeb55c37377833d5c0a601d0f6af06a7e9cd483443cc"}
