{"change_digest":"sha256:f5dccea8be984c915b8866bf978d672d9eb4556820c532aa0a0e3de1895db667","check_id":"schema-validate","disposition":"ALLOW","hb_epoch":"4000","head_sha":"9338e3e7f84b22fb9ddc3f55bf50c28561db111e","schema":"stegverse.sv_check_receipt.v1","verifier_ref":"SV-LLM/.github:sandbox/s1_sv_check_receipts.py#sha256:ec4d3610ca8cc5fd504dca5f6ec8d65f5523bd819bdd7d046a5e9563ef53e203"}
