{"change_digest":"sha256:d1bb3828fe0bd93a81727f379ddc713b77475db8032b71f8b962fcfcd1610677","check_id":"registry-generation-fence","disposition":"ALLOW","hb_epoch":"469411750","head_sha":"764070689f0dd793c987d27d7cbf3252f37a6b47","schema":"stegverse.sv_check_receipt.v1","verifier_ref":"SV-LLM/.github:sandbox/s1_sv_check_receipts.py#sha256:5d1d6479d9556bb90d9871b44530777023595a249c6beee3e8a0fbef27a63fce"}
