{"change_digest":"sha256:4c217bcf70d2761371703408ea2be8861b9d31e716dfa266f15f4068dcc1c912","check_id":"registry-generation-fence","disposition":"ALLOW","hb_epoch":"469411750","head_sha":"f82c0324aa4b6ac74adc44a3541ac98b33826447","schema":"stegverse.sv_check_receipt.v1","verifier_ref":"SV-LLM/.github:sandbox/s1_sv_check_receipts.py#sha256:9bc988fcbcae1ec4d3c582cd159b8475370673edddcd739727e2aefef412a478"}
