{"change_digest":"sha256:1a70ad70ab1c24d11186d2049adfcfd1e0dce7662f87da4f61bdf11e55c6c103","check_id":"registry-generation-fence","disposition":"ALLOW","hb_epoch":"469411750","head_sha":"e6ba9601933c1c9d58f6b704c2a119544d21cb4d","schema":"stegverse.sv_check_receipt.v1","verifier_ref":"SV-LLM/.github:sandbox/s1_sv_check_receipts.py#sha256:069fd1bd6b72126a330cd7a2f4dc833cc865f0e53e622ae660bb7ccc526b2d75"}
