{"change_digest":"sha256:332e03ae6fff6a8acfbec7494004a117ec91acc15937b700755fd6cb0e81fcb2","check_id":"supplied-epoch-binder-check","disposition":"FAIL_CLOSED","failed_predicate":"SUBMISSION_CARRIES_THE_SUPPLIED_HB_EPOCH","failure_code":"HB_EPOCH_SOURCE_UNOBSERVED","hb_epoch":"469411750","head_sha":"e29493afce3ee7b50c663a0fd5499a489ecc644b","next_attempt":"after the SV_CHANGE is re-derived carrying the observed epoch 469411750; nothing was admitted","owning_existing_goal":"StegVerse-org/.github#162","required_evidence_or_repair":"the SV_CHANGE carries a supplied hb_epoch (ASCII digits, 726248a5) equal to the sealed epoch 469411750 at base_ref.ledger_head a5bb54d81893b392a3ce28182986fc39857807e1; absent, null, \"\", \"null\" and UNKNOWN_NOT_AUTHENTICALLY_OBSERVED are unobserved","retry_entrypoint":"SV-LLM/.github#46 sandbox/s1_sv_check_receipts.py mint (verifier built-in supplied-epoch-binder-check) at a successor SV_CHANGE head","schema":"stegverse.sv_check_receipt.v1","verifier_ref":"SV-LLM/.github:sandbox/s1_sv_check_receipts.py#sha256:4fc2f97a593474e3356f02d8361d3d9fdfad1ac1265dbb9440484b9a2efe0515"}
